"regexps (list(tuple(str, str))) – A list of (regexp, tag) pairs, each of which indicates that a word matching regexp should be tagged with tag. The pairs will be evalutated in order. If none of the regexps match a word, then the optional backoff tagger is invoked, else it is assigned the tag None.","match word,assign tag none"
"Decide which tag should be used for the specified token, and return that tag. If this tagger is unable to determine a tag for the specified token, return None – do not consult the backoff tagger. This method should be overridden by subclasses of SequentialBackoffTagger.","use tag for specified token,return tag,determine tag for specified token,return None,override method"
index (int) – The index of the word whose tag should be returned.,"return tag,return word"
"An abstract base class for taggers that tags words sequentially, left to right. Tagging of individual words is performed by the choose_tag() method, which should be defined by subclasses. If a tagger is unable to determine a tag for the specified token, then its backoff tagger is consulted.","perform tagging of individual words,define choose_tag() method,determine tag for specified token"
"Decide which tag should be used for the specified token, and return that tag. If this tagger is unable to determine a tag for the specified token, return None – do not consult the backoff tagger. This method should be overridden by subclasses of SequentialBackoffTagger.","use tag for specified token,return tag,determine tag for specified token,return None,override method"
index (int) – The index of the word whose tag should be returned.,"return tag,return word"
"Determine the most appropriate tag sequence for the given token sequence, and return a corresponding list of tagged tokens. A tagged token is encoded as a tuple (token, tag).","determine appropriate tag sequence for given token sequence,return corresponding list of tagged tokens,encode tagged token as tuple (token, tag)"
"Determine an appropriate tag for the specified token, and return that tag. If this tagger is unable to determine a tag for the specified token, then its backoff tagger is consulted.","determine appropriate tag for specified token,return tag,determine tag for specified token"
index (int) – The index of the word whose tag should be returned.,"return tag,return word"
"A tagger that chooses a token’s tag based its word string and on the preceding two words’ tags. In particular, a tuple consisting of the previous two tags and the word is looked up in a table, and the corresponding tag is returned.","choose tag,return corresponding tag"
"The UnigramTagger finds the most likely tag for each word in a training corpus, and then uses that information to assign tags to new tokens.","find likely tag for word,use information,assign tags to new tokens"
Tagger models need to be downloaded from https://nlp.stanford.edu/software and the STANFORD_MODELS environment variable set (a colon-separated list of paths).,"download  from https://nlp.stanford.edu/software,download  from STANFORD_MODELS environment variable set"
"(optionally) the path to the stanford tagger jar file. If not specified here, then this jar file must be specified in the CLASSPATH envinroment variable.",specify jar file in CLASSPATH envinroment variable
"(optionally) the path to the stanford tagger jar file. If not specified here, then this jar file must be specified in the CLASSPATH envinroment variable.",specify jar file in CLASSPATH envinroment variable
_cmd property: A property that returns the command that will be executed.,"return command,return property,execute command"
_SEPARATOR: Class constant that represents that character that is used to separate the tokens from their tags.,"separate tokens from tags,use character"
"Determine the most appropriate tag sequence for the given token sequence, and return a corresponding list of tagged tokens. A tagged token is encoded as a tuple (token, tag).","determine appropriate tag sequence for given token sequence,return corresponding list of tagged tokens,encode tagged token as tuple (token, tag)"
return [self.tag(sent) for sent in sentences],"return [ self.tag(sent),send  in sentences ]"
"It is possible to provide an untrained POS tagger to create tags for unknown words, see __init__ function","provide untrained POS tagger,create tags for unknown words"
"However it still produces good results if the training data and testing data are separated on all punctuation eg: [,.?!]","produce good results,separate training data on punctuation eg,separate testing data on punctuation eg"
Function provided to process text that is unsegmented,process text
"TnT uses a second order Markov model to produce tags for a sequence of input, specifically:",produce tags for sequence
The set of possible tags for a given word is derived from the training data. It is the set of all tags that exact word has been assigned.,assign exact word
"To speed up and get more precision, we can use log addition to instead multiplication, specifically:","get more precision,use log addition"
A beam search is used to limit the memory usage of the algorithm. The degree of the beam can be changed using N in the initialization. N represents the maximum number of possible solutions to maintain while tagging.,"limit memory usage of algorithm,use beam search,use n in initialization,change degree of beam"
It is possible to differentiate the tags which are assigned to capitalized words. However this does not result in a significant gain in the accuracy of the results.,"differentiate tags,assign tags to capitalized words"
Calls recursive function ‘_tagword’ to produce a list of tags,produce list of tags
Associates the sequence of returned tags with the correct words in the input sequence,"return tags with correct words,return tags in input sequence"
"returns a list of (word, tag) tuples",return list of tuples
"Invokes tag(sent) function for each sentence compiles the results into a list of tagged sentences each tagged sentence is a list of (word, tag) tuples",compile results into list
"Uses a set of tagged data to train the tagger. If an unknown word tagger is specified, it is trained on the same data.","use set of tagged data,specify unknown word tagger"
raw (bool) – boolean flag marking the input data as a list of words or a list of tagged words,"mark input data as list,mark input data as list"
Function takes a list of tokens and separates the tokens into lists where each list represents a sentence fragment This function can separate both tagged and raw sequences into basic sentences.,"separate tokens into lists,separate tagged raw sequences into basic sentences"
"Given the string representation of a tagged token, return the corresponding tuple representation. The rightmost occurrence of sep in s will be used to divide s into a word string and a tag string. If sep does not occur in s, return (s, None).","return corresponding tuple representation,divide  into word string,divide  into tag string,use rightmost occurrence of sep"
sep (str) – The separator string used to separate word strings from tags.,"use  from tags,use  to separate word strings"
"Given the tuple representation of a tagged token, return the corresponding string representation. This representation is formed by concatenating the token’s word string, followed by the separator, followed by the token’s tag. (If the tag is None, then just return the bare word string.)",return corresponding string representation
sep (str) – The separator string used to separate word strings from tags.,"use  from tags,use  to separate word strings"
"Given a tagged sentence, return an untagged version of that sentence. I.e., return a list containing the first element of each tuple in tagged_sentence.","return untagged version of sentence,return list"
"A “tag” is a case-sensitive string that specifies some property of a token, such as its part of speech. Tagged tokens are encoded as tuples (tag, token). For example, the following tagged token combines the word 'fly' with a noun part of speech tag ('NN'):","specify property such_as part,specify case-sensitive string such_as part,encode tagged tokens as tuples (tag, token),combine word 'fly' with noun part"
An off-the-shelf tagger is available for English. It uses the Penn Treebank tagset:,use Penn treebank tagset
A Russian tagger is also available if you specify lang=”rus”. It uses the Russian National Corpus tagset:,use Russian national Corpus tagset
"This package defines several taggers, which take a list of tokens, assign a tag to each one, and return the resulting list of tagged tokens. Most of the taggers are built automatically based on a training corpus. For example, the unigram tagger tags each word w by checking what the most frequent tag for w was in a training corpus:","define several taggers,assign tag,assign several taggers,return resulting list of tagged tokens,return several taggers of tagged tokens"
Note that words that the tagger has not seen during training receive a tag of None.,receive tag of None
NB. Use pos_tag_sents() for efficient tagging of more than one sentence.,use pos_tag_sents() for efficient tagging
