Paragraph,Tasks
"A processing interface for assigning a tag to each token in a list. Tags are case sensitive strings that identify some property of each token, such as its part of speech or its sense.","Assign tag
Identify property such as part of speech"
"Score the accuracy of the tagger against the gold standard. Strip the tags from the gold standard text, retag it using the tagger, then compute the accuracy score.","Compute accuracy score
Use tagger"
"Determine the most appropriate tag sequence for the given token sequence, and return a corresponding list of tagged tokens. A tagged token is encoded as a tuple (token, tag).","Determine appropriate tag sequence for given token sequence
Return corresponding list of tagged tokens
Encode tagged token as tuple (token
tag)"
return [self.tag(sent) for sent in sentences],
Brill’s transformational rule-based tagger. Brill taggers use an initial tagger (such as tag.DefaultTagger) to assign an initial tag sequence to a text; and then apply an ordered list of transformational rules to correct the tags of individual tokens. These transformation rules are specified by the TagRule interface.,"Use initial tagger
Assign initial tag sequence to text
Apply ordered list of transformational rules
Specify transformational rules"
"Brill taggers can be created directly, from an initial tagger and a list of transformational rules; but more often, Brill taggers are created by learning rules from a training corpus, using one of the TaggerTrainers available.","Create Brill taggers
Learn rules from training corpus
Create Brill taggers from initial tagger"
Tags by applying each rule to the entire corpus (rather than all rules to a single sequence). The point is to collect statistics on the test set for individual rules.,"Apply rule to entire corpus
Set individual rules"
"NOTE: This is inefficient (does not build any index, so will traverse the entire corpus N times for N rules) – usually you would not care about statistics for individual rules and thus use batch_tag() instead",Use batch_tag()
"Print a list of all templates, ranked according to efficiency.",Print list of templates
"If test_stats is available, the templates are ranked according to their relative contribution (summed for all rules created from a given template, weighted by score) to the performance on the test set. If no test_stats, then statistics collected during training are used instead. There is also an unweighted measure (just counting the rules). This is less informative, though, as many low-score rules will appear towards end of training.",Use statistics 
"printunused (bool) – if True, print a list of all unused templates",Print unused templates
Return the ordered list of transformation rules that this tagger has learnt,Order list of transformation rules
the ordered list of transformation rules that correct the initial tagging,
"Determine the most appropriate tag sequence for the given token sequence, and return a corresponding list of tagged tokens. A tagged token is encoded as a tuple (token, tag).","Determine appropriate tag sequence for given token sequence
Return corresponding list of tagged tokens
Encode tagged token as tuple (token
tag)"
"Return a named statistic collected during training, or a dictionary of all available statistics if no name given","Return named statistic of available statistics
Return dictionary of available statistics"
"Print the available template sets in this demo, with a short description”",Print templates
"Trains the Brill tagger on the corpus train_sents, producing at most max_rules transformations, each of which reduces the net number of errors in the corpus by at least min_score, and each of which has accuracy not lower than min_acc.",Produce at most max_rules transformations
"#templates >>> Template._cleartemplates() #clear any templates created in earlier tests >>> templates = [Template(Pos([-1])), Template(Pos([-1]), Word([0]))]",
"# a high-accuracy tagger >>> tagger2 = tt.train(training_data, max_rules=10, min_acc=0.99) TBL train (fast) (seqs: 100; tokens: 2417; tpls: 2; min score: 2; min acc: 0.99) Finding initial useful rules…",Find initial useful rules
Found 845 useful rules.,
S F r O | Score = Fixed - Broken c i o t | R Fixed = num tags changed incorrect -> correct o x k h | u Broken = num tags changed correct -> incorrect r e e e | l Other = num tags changed incorrect -> incorrect e d n r | e,
min_score (int) – stop training when no rules better than min_score can be found,
the learned tagger,
A module for POS tagging using CRFSuite,Use CRFSuite
A module for POS tagging using CRFSuite https://pypi.python.org/pypi/python-crfsuite,Use Crfsuite
Train a new model using ``train’’ function,Train new model
Use the pre-trained model which is set via ``set_model_file’’ function,"Use pre-trained model
Set pre-trained model via set_model_file function"
Train a new model using ``train’’ function,
Use the pre-trained model which is set via ``set_model_file’’ function,"Use pre-trained model
Set pre-trained model via set_model_file function"
"Train the CRF tagger using CRFSuite :params train_data : is the list of annotated sentences. :type train_data : list (list(tuple(str,str))) :params model_file : the model will be saved to this file.","Use CRFSuite
Save model to file"
"Hidden Markov Models (HMMs) largely used to assign the correct label sequence to sequential data or assess the probability of a given label and data sequence. These models are finite state machines characterised by a number of states, transitions between these states, and output symbols emitted while in each state. The HMM is an extension to the Markov chain, where each state corresponds deterministically to a given event. In the HMM the observation is a probabilistic function of the state. HMMs share the Markov chain’s assumption, being that the probability of transition from one state to another only depends on the current state - i.e. the series of states that led to the current state are not used. They are also time invariant.",Assign correct label sequence to sequential data
"The HMM is a directed graph, with probability weighted edges (representing the probability of a transition between the source and sink states) where each vertex emits an output symbol when entered. The symbol (or observation) is non-deterministically generated. For this reason, knowing that a sequence of output observations was generated by a given HMM does not mean that the corresponding sequence of states (and what the current state is) is known. This is the ‘hidden’ in the hidden markov model.","Generate symbol
Generate sequence of output observations"
"To ground this discussion, take a common NLP application, part-of-speech (POS) tagging. An HMM is desirable for this task as the highest probability tag sequence can be calculated for a given sequence of word forms. This differs from other tagging techniques which often tag each word individually, seeking to optimise each individual tagging greedily without regard to the optimal combination of tags for a larger unit, such as a sentence. The HMM does this with the Viterbi algorithm, which efficiently computes the optimal path through the graph given the sequence of words forms.","Calculate highest probability for given sequence
Compute optimal path through graph"
"This discussion assumes that the HMM has been trained. This is probably the most difficult task with the model, and requires either MLE estimates of the parameters or unsupervised learning using the Baum-Welch algorithm, a variant of EM.",Use Baum-Welch algorithm
"For more information, please consult the source code for this module, which includes extensive demonstration code.",
"Hidden Markov model class, a generative model for labelling sequence data. These models define the joint probability of a sequence of symbols and their labels (state transitions) as the product of the starting state probability, the probability of each state transition, and the probability of each observation being generated from each state. This is described in more detail in the module documentation.",
"This implementation is based on the HMM description in Chapter 8, Huang, Acero and Hon, Spoken Language Processing and includes an extension for training shallow HMM parsers or specialized HMMs as in Molina et. al, 2002. A specialized HMM modifies training data by applying a specialization function to create a new training set that is more appropriate for sequential tagging with an HMM. A typical use case is chunking.","Modify training data by applying
Apply specialization function
Create new training set"
outputs (ConditionalProbDistI) – output probabilities; Pr(o_k | s_i) is the probability of emitting symbol k when entering state i,
Returns the state sequence of the optimal (most probable) path through the HMM. Uses the Viterbi algorithm to calculate this part by dynamic programming.,"Return state sequence through HMM
Return state sequence of optimal path"
"Returns the state sequence of the optimal (most probable) path through the HMM. Uses the Viterbi algorithm to calculate this part by dynamic programming. This uses a simple, direct method, and is included for teaching purposes.","Return the state sequence through HMM
Return state sequence of optimal path
Use simple directed method"
Returns the entropy over labellings of the given sequence. This is given by:,Return entropy over labellelings
"The order of summation for the log terms can be flipped, allowing dynamic programming to be used to calculate the entropy. Specifically, we use the forward and backward probabilities (alpha, beta) giving:",Calculate entropy
"This simply uses alpha and beta to find the probabilities of partial sequences, constrained to include the given state(s) at some point in time.","Find probabilities of partial sequences
Include given state at point"
"Returns the log-probability of the given symbol sequence. If the sequence is labelled, then returns the joint log-probability of the symbol, state sequence. Otherwise, uses the forward algorithm to find the log-probability over all label sequences.","Return log-probability of given symbol sequence
Return joint log-probability of symbol
Find log-probability over label sequences"
"Returns the pointwise entropy over the possible states at each position in the chain, given the observation sequence.",Return pointwise entropy over possible states
"Returns the probability of the given symbol sequence. If the sequence is labelled, then returns the joint probability of the symbol, state sequence. Otherwise, uses the forward algorithm to find the probability over all label sequences.","Return probability of given symbol sequence'
' Return joint probability of symbol'
' Find probability over label sequence"
"Randomly sample the HMM to generate a sentence of a given length. This samples the prior distribution then the observation distribution and transition distribution for each subsequent observation and state. This will mostly generate unintelligible garbage, but can provide some amusement.",Generate sentence of given length
Tags the sequence with the highest probability state sequence. This uses the best_path method to find the Viterbi path.,"Tag highest probability state sequence
Find Viterbi path"
verbose (bool) – boolean flag indicating whether training should be verbose or include printed output,Include printed output
Train a new HiddenMarkovModelTagger using the given labeled and unlabeled training instances. Testing will be performed if test instances are provided.,"Use given labeled
Use unlabeled training instances
Perform testing
Provide test instances"
verbose (bool) – boolean flag indicating whether training should be verbose or include printed output,Include printed output
Algorithms for learning HMM parameters from training data. These include both supervised learning (MLE) and unsupervised learning (Baum-Welch).,"Learn HMM parametercs from training data
Unclude supervised learning
Include unsupervised learning"
"Creates an HMM trainer to induce an HMM with the given states and output symbol alphabet. A supervised and unsupervised training method may be used. If either of the states or symbols are not given, these may be derived from supervised training.",Use supervised unsupervised training method
Trains the HMM using both (or either of) supervised and unsupervised techniques.,Use supervised unsupervised techniques
kwargs – additional arguments to pass to the training methods,Pass to training methods
estimator – a function taking a FreqDist and a number of bins and returning a CProbDistI; otherwise a MLE estimate is used,"Return CProbDistl
Use MLE estimate"
"Trains the HMM using the Baum-Welch algorithm to maximise the probability of the data sequence. This is a variant of the EM algorithm, and is unsupervised in that it doesn’t need the state sequences for the symbols. The code is based on ‘A Tutorial on Hidden Markov Models and Selected Applications in Speech Recognition’, Lawrence Rabiner, IEEE, 1989.",Use Baum-Welch algorithm
kwargs may include following parameters:,
"This class communicates with the hunpos-tag binary via pipes. When the tagger object is no longer needed, the close() method should be called to free system resources. The class supports the context manager interface; if used in a with statement, the close() method is invoked automatically:","Call close() method to free system resources
Support context manager interface"
"Interface for converting POS tags from various treebanks to the universal tagset of Petrov, Das, & McDonald.","Convert POS tags from various treebanks
Convert POS tags to universal tagset"
Retrieve the mapping dictionary between tagsets.,Retrieve mapping dictionary between tagsets
"An averaged perceptron, as implemented by Matthew Honnibal.",
Dot-product the features and current weights and return the best label.,Return best label
Save the pickled model weights.,Save pickled model weights
Update the feature weights.,Update feature weights
"Greedy Averaged Perceptron tagger, as implemented by Matthew Honnibal. See more implementation details here:",
Use the pretrain model (the default constructor),Use pretrain model
Normalization used in pre-processing. - All words are lower cased - Groups of digits of length 4 are represented as !YEAR; - Other digits are represented as !DIGITS,Use in pre-processing
"Train a model from sentences, and save it at save_loc. nr_iter controls the number of Perceptron training iterations.",Save at save_loc
"save_loc – If not None, saves a pickled model in this location.",Save pickled model in location
SennaTagger will automatically search for executable file specified in SENNA environment variable,Specify in SENNA environment variable
Note: Unit tests for this module can be found in test/unit/test_senna.py,Find unit tests in test/unit/test_senna.py
"Applies the tag method over a list of sentences. This method will return for each sentence a list of tuples of (word, tag).","Return list of tuples
Return list of sentences"
"Applies the tag method over a list of sentences. This method will return for each sentence a list of tuples of (word, tag).","Return list of tuples
Return list of sentences"
"Applies the tag method over a list of sentences. This method will return for each sentence a list of tuples of (word, tag).","Return list of tuples
Return list of sentences"
"Classes for tagging sentences sequentially, left to right. The abstract base class SequentialBackoffTagger serves as the base class for all the taggers in this module. Tagging of individual words is performed by the method choose_tag(), which is defined by subclasses of SequentialBackoffTagger. If a tagger is unable to determine a tag for the specified token, then its backoff tagger is consulted instead. Any SequentialBackoffTagger may serve as a backoff tagger for any other SequentialBackoffTagger.","Perform tagging of individual words
Determine tag for specified token"
"A tagger that chooses a token’s tag based on a leading or trailing substring of its word string. (It is important to note that these substrings are not necessarily “true” morphological affixes). In particular, a fixed-length substring of the word is looked up in a table, and the corresponding tag is returned. Affix taggers are typically constructed by training them on a tagged corpus.","Choose tag
Choose tagger
Return corresponding tag"
affix_length – The length of the affixes that should be considered during training and tagging. Use negative numbers for suffixes.,Use negative numbers for suffixes
min_stem_length – Any words whose length is less than min_stem_length+abs(affix_length) will be assigned a tag of None by this tagger.,"Assign tag of None
Assign min_stem_length+abs(affix_length) of None"
"A tagger that chooses a token’s tag based its word string and on the preceding words’ tag. In particular, a tuple consisting of the previous tag and the word is looked up in a table, and the corresponding tag is returned.","Choose tag
Return corresponding tag"
Return the feature detector that this tagger uses to generate featuresets for its classifier. The feature detector is a function with the signature:,"Return feature detector
Generate featuresets for classifier"
A sequential tagger that uses a classifier to choose the tag for each token in a sentence. The featureset input for the classifier is generated by a feature detector function:,"Use classifier
Choose tag
Generate featureset input for classifier"
Where tokens is the list of unlabeled tokens in the sentence; index is the index of the token for which feature detection should be performed; and history is list of the tags for all tokens before index.,"Perform detection of tags
Perform index of tags
Perform list of tags"
"feature_detector – A function used to generate the featureset input for the classifier:: feature_detector(tokens, index, history) -> featureset",Generate featureset input for classifier
"classifier – The classifier that should be used by the tagger. This is only useful if you want to manually construct the classifier; normally, you would use train instead.","Use classifier
Use train"
"backoff – A backoff tagger, used if this tagger is unable to determine a tag for a given token.",
"Decide which tag should be used for the specified token, and return that tag. If this tagger is unable to determine a tag for the specified token, return None – do not consult the backoff tagger. This method should be overridden by subclasses of SequentialBackoffTagger.","Use tag for specified token
Determine tag for specified token
Override method"
index (int) – The index of the word whose tag should be returned.,"Return index
Return word"
Return the classifier that this tagger uses to choose a tag for each word in a sentence. The input for this classifier is generated using this tagger’s feature detector. See feature_detector(),"Return classifier
Choose tag for word
Use feature detector
Generate input for classifier"
Return the feature detector that this tagger uses to generate featuresets for its classifier. The feature detector is a function with the signature:,"Return feature detector
Generate featuresets for classifier"
An abstract base class for sequential backoff taggers that choose a tag for a token based on the value of its “context”. Different subclasses are used to define different contexts.,"Choose tag
Define different contexts
User different subclasses"
"A ContextTagger chooses the tag for a token by calculating the token’s context, and looking up the corresponding tag in a table. This table can be constructed manually; or it can be automatically constructed based on a training corpus, using the _train() factory method.","Choose tag by looking
Choose tag by calculating
Calculate context
Use _train() factory method"
"Decide which tag should be used for the specified token, and return that tag. If this tagger is unable to determine a tag for the specified token, return None – do not consult the backoff tagger. This method should be overridden by subclasses of SequentialBackoffTagger.","Use tag for specified token
Determine tag for specified token
Override method"
index (int) – The index of the word whose tag should be returned.,"Return index
Return word"
The number of entries in the table used by this tagger to map from contexts to tags.,
A tagger that assigns the same tag to every token.,Assign same tag
"This tagger is recommended as a backoff tagger, in cases where a more powerful tagger is unable to assign a tag to the word (e.g. because the word was not seen during training).",Assign tag to word
"Decide which tag should be used for the specified token, and return that tag. If this tagger is unable to determine a tag for the specified token, return None – do not consult the backoff tagger. This method should be overridden by subclasses of SequentialBackoffTagger.","Use tag for specified token
Determine tag for specified token
Override method"
index (int) – The index of the word whose tag should be returned.,"Return index
Return word"
"A tagger that chooses a token’s tag based on its word string and on the preceding n word’s tags. In particular, a tuple (tags[i-n:i-1], words[i]) is looked up in a table, and the corresponding tag is returned. N-gram taggers are typically trained on a tagged corpus.","Choose tag
Return corresponding tag"
"Train a new NgramTagger using the given training data or the supplied model. In particular, construct a new tagger whose table maps from each context (tag[i-n:i-1], word[i]) to the most frequent tag for that context. But exclude any contexts that are already tagged perfectly by the backoff tagger.","Use given training data
Use supplied model
Exclude contexts"
"cutoff – If the most likely tag for a context occurs fewer than cutoff times, then exclude it from the context-to-tag table for the new tagger.",Exclude from context-to-tag table
The RegexpTagger assigns tags to tokens by comparing their word strings to a series of regular expressions. The following tagger uses word suffixes to make guesses about the correct Brown Corpus part of speech tag:,"Assign tags by comparing
Assign tags to tokens"
"regexps (list(tuple(str, str))) – A list of (regexp, tag) pairs, each of which indicates that a word matching regexp should be tagged with tag. The pairs will be evalutated in order. If none of the regexps match a word, then the optional backoff tagger is invoked, else it is assigned the tag None.",Match word
"Decide which tag should be used for the specified token, and return that tag. If this tagger is unable to determine a tag for the specified token, return None – do not consult the backoff tagger. This method should be overridden by subclasses of SequentialBackoffTagger.","Use tag for specified token
Determine tag for specified token
Override method"
index (int) – The index of the word whose tag should be returned.,"Return index
Return word"
"An abstract base class for taggers that tags words sequentially, left to right. Tagging of individual words is performed by the choose_tag() method, which should be defined by subclasses. If a tagger is unable to determine a tag for the specified token, then its backoff tagger is consulted.","Perform tagging of individual words
Determine tag for specified token"
"Decide which tag should be used for the specified token, and return that tag. If this tagger is unable to determine a tag for the specified token, return None – do not consult the backoff tagger. This method should be overridden by subclasses of SequentialBackoffTagger.","Use tag for specified token
Determine tag for specified token
Override method"
index (int) – The index of the word whose tag should be returned.,"Return index
Return word"
"Determine the most appropriate tag sequence for the given token sequence, and return a corresponding list of tagged tokens. A tagged token is encoded as a tuple (token, tag).","Determine appropriate tag sequence for given token sequence
Return corresponding list of tagged tokens
Encode tagged token as tuple (token
tag)"
"Determine an appropriate tag for the specified token, and return that tag. If this tagger is unable to determine a tag for the specified token, then its backoff tagger is consulted.","Determine appropriate tag for specified token
Determine tag for specified token"
index (int) – The index of the word whose tag should be returned.,"Return index
Return word"
"A tagger that chooses a token’s tag based its word string and on the preceding two words’ tags. In particular, a tuple consisting of the previous two tags and the word is looked up in a table, and the corresponding tag is returned.","Choose tag
Return corresponding tag"
"The UnigramTagger finds the most likely tag for each word in a training corpus, and then uses that information to assign tags to new tokens.","Find likely tag for word
Assign tags to new tokens"
Tagger models need to be downloaded from https://nlp.stanford.edu/software and the STANFORD_MODELS environment variable set (a colon-separated list of paths).,
"(optionally) the path to the stanford tagger jar file. If not specified here, then this jar file must be specified in the CLASSPATH envinroment variable.",Specify jar file in CLASSPATH environment variable
"(optionally) the path to the stanford tagger jar file. If not specified here, then this jar file must be specified in the CLASSPATH envinroment variable.",Specify jar file in CLASSPATH environment variable
_cmd property: A property that returns the command that will be executed.,"Return command
execute command"
_SEPARATOR: Class constant that represents that character that is used to separate the tokens from their tags.,Separate tokens from tags
